"";"Codigo";"X";"Y";"Pais";"Clase";"Cita";"Fecha";"Autor(es)";"year";"Titulo";"Palabras Clave";"Resumen";"Tematica";"Link";"Tipo";"filtroE";"filtroP";"Bioma"
"396";"Peces_007";-1,4666667;-79,583055;"Ecuador";"PECES";"Ubilla et al. 2016";NA;"Ochoa B; Mendoza K; Vivas R; Urdánigo J; Ferrer Y";2016;"Estructura de tallas de captura y relación longitud-peso de peces nativos en el humedal Abras de Mantequilla; Ecuador";"Recruitment; allometric; allometric; isometric; lentic; lotic; ichthyofauna";"The objective of this study was to identify the composition of catches; to describe the size structure and to determine the length-weight ratio of the main species of native sh of commercial interest in the Abras de Mantequilla wetland (AdM). During April to September; 492 shes from the wetland AdM were randomly collected; the total length (Tl) and the total weight (Tw) were measured for each specimen. For the taxonomic identi cation of the species the keys; guides and specialized catalogs were used. The size structure was analyzed by frequency histograms; the mean catch sizes (MCZ) were compared with permitted commercial size (PCS) and mean maturity size (MMS). The length-weight relationship was estimated using the Ricker allometry equation. The most abundant species was Ichthyolephas humeralis followed by Pseudocurimata spp.; while Leporinus ecuadoriensis was the least captured species. Rhamdia cinerascens presented a MCZ of 24.81 cm (Tl); inferior to the average size of maturity (25 cm Tl). Ichthyolephas humeralis; Andinoacara rivulatus and Pseudocurimata spp. presented negative allometric growth; while the rest of species have isometric growth. In most sh species recruitment occurred at an optimal age and size in which the sh already contributed with new individuals to the population. It was evidenced that there is a relation between the species with negative allometric growth and its abundance in the catches.";"Conservación";"NA";"Artículo";"Western Ecuador moist forests";"Ecuador";"Bosques lluviosos"
"397";"Peces_008";-2,223725;-80,118538;"Ecuador";"PECES";"Chicaiza et al. 2015";NA;"Chicaiza D; Flores H";2015;"Parámetros biológicos de Pseudocurimata boulengeri (Characiformes: Curimatidae) en el embalse Chongón; Ecuador";"sex ratio; length-weight relationship; reproduction; spawning; size at maturity";"Pseudocurimata boulengeri is an endemic species of Ecuador; which sustains a large group of fisher families. The biological data of this species correspond to reports from lotic systems of Los Ri´os province; nevertheless; their trend in a lentic system is not yet known. This paper describes the sex ratio; length-weight relationship; gonad development; spawning season and size at reproductive maturity of P. boulengeri; inhabiting the lentic system of Chongo´n dam; Ecuador. Fish were caught between 2003 and 2009 using gill nets (2.5”). The total length (Lt) of caught specimens ranged from 10.5 to 35.5 cm; spawning occurred between the months of October and March; and size at first maturity for females was estimated at 17.9 cm (Lt) and 20.0 cm (Lt) for males. Between May and October male and female ratios were as expected (1:1); whereas for May; November and April; females ratios were higher than males; situation that coincided with the spawning season. The limnetic conditions and high production characteristics of Chongo´n dam; have promoted the avail- ability of a great amount of food for this species; which may have allowed P. boulengeri to have a more extended reproductive season in this favorable environment. Rev. Biol. Trop. 64 (1): 131-146. Epub 2016 March 01.";"Ecología";"https://bit.ly/3ejqVUW";"Artículo";"Western Ecuador moist forests";"Ecuador";"Bosques lluviosos"
"398";"Peces_009";-1,9391667;-79,756333;"Ecuador";"PECES";"Jiménez et al. 2009";NA;"Jiménez P; Alava J";2009;"Infección por Gnathostoma (Spirurida: Gnathostomatidae) en Hoplias microlepis: prevalencia; correlación con la talla del pez; huéspedes e implicaciones para salud pública en Ecuador";"Gnathostoma; larva migrans; interacciones huésped-parásito; salud pública; Ecuador";"A total of 74 fish were collected from two localities (rice fields-wetlands and local fish market) of Samborondo´n County (Guayas Province). Each was examined for the presence of Gnathostoma in muscle of Hoplias microlepis. The abundance intensity and prevalence of parasites was estimated. Statistical comparisons between the two sites and correlations of parasite load versus fish size were conducted.";"Ecología";"https://bit.ly/3tmQV6e";"Artículo";"Guayaquil flooded grasslands";"Ecuador";"Bosques secos"
"399";"Peces_010";-2,223725;-80,118538;"Ecuador";"PECES";"Pacheco 2014";NA;"Pacheco J";2014;"Aspectos Pesqueros de las Principales Especies Capturadas en el Embalse Parque Lago Chongón; Durante 2014";"Chongo´n Reservoir; average size at maturity; stages; gonads";"Since 2003 the National Fisheries Institute (INP) performs a biological and fishery survey of the main species caught in the reservoir Chongo´n in order to know the status of existing resources and to develop recommendations for the purposes of fisheries management and tracking system. During the year 2014; monthly field trips to the reservoir were performed to obtain the biological and fishing information. The estimated total landing was 100.5 t; a decrease of 52.3% compared to 2013 was observed; Pseudocurimata boulengeri was the most representative species in gillnet catches (44.5%); with an average maturity size of 24.0 cm TL and an average weight of 194.6 g in females and 159.6 g in males; followed by Andinoacara rivulatus (19.4%); Cherax quadricarinatus (14.9 %) caught by traps; Hoplias microlepis (12.8%); Oreochromis spp. (3.3%) and Brycon albunus (5.1%). The abundant presence of aquatic floating plants on the banks of the reservoir; hampered fishing and boating activities. The catch average size of freshwater lobster for both sexes was 11.0 cm TL; lower than recommended by the INP 11.5 cm TL minimum size. Sexually mature gonads of fish examined were mainly observed in the months of January (77.9%); February (72.9%) and March (69.8%) and spawning took place in April (86.6 %) and May (79.1%) in 2014.";"Ecología";"https://bit.ly/3eZBwDp";"Artículo";"Western Ecuador moist forests";"Ecuador";"Bosques lluviosos"
"400";"Peces_011";-2,223726;-80,118539;"Ecuador";"PECES";"Pacheco 2015";NA;"Pacheco J";2015;"Aspectos Pesqueros de las Principales Especies Capturadas en el Embalse Parque Lago Chongón; Durante 2015";"Chongon reservoir; average size at maturity; stages; gonads";"Since 2003 the National Fisheries Institute (INP) performs a biological and fishery survey of the main species caught in the reservoir Chongo´n in order to know the status of existing resources and to develop recommendations for the purposes of fisheries management and tracking system. During the year 2014; monthly field trips to the reservoir were performed to obtain the biological and fishing information. The estimated total landing was 100.5 t; a decrease of 52.3% compared to 2013 was observed; Pseudocurimata boulengeri was the most representative species in gillnet catches (44.5%); with an average maturity size of 24.0 cm TL and an average weight of 194.6 g in females and 159.6 g in males; followed by Andinoacara rivulatus (19.4%); Cherax quadricarinatus (14.9 %) caught by traps; Hoplias microlepis (12.8%); Oreochromis spp. (3.3%) and Brycon albunus (5.1%). The abundant presence of aquatic floating plants on the banks of the reservoir; hampered fishing and boating activities. The catch average size of freshwater lobster for both sexes was 11.0 cm TL; lower than recommended by the INP 11.5 cm TL minimum size. Sexually mature gonads of fish examined were mainly observed in the months of January (77.9%); February (72.9%) and March (69.8%) and spawning took place in April (86.6 %) and May (79.1%) in 2014.";"Ecología";"https://bit.ly/33gZQLB";"Artículo";"Western Ecuador moist forests";"Ecuador";"Bosques lluviosos"
"401";"Peces_012";-2,223727;-80,11854;"Ecuador";"PECES";"Pacheco 2017";NA;"Pacheco J";2017;"Aspectos Pesqueros de las Principales Especies Capturadas en el Embalse Parque Lago Chongón; Durante 2017";"Chongon reservoir; average size at maturity; stages; gonads";"Since 2003 the National Fisheries Institute (INP) performs a biological and fishery survey of the main species caught in the reservoir Chongo´n in order to know the status of existing resources and to develop recommendations for the purposes of fisheries management and tracking system. During the year 2014; monthly field trips to the reservoir were performed to obtain the biological and fishing information. The estimated total landing was 100.5 t; a decrease of 52.3% compared to 2013 was observed; Pseudocurimata boulengeri was the most representative species in gillnet catches (44.5%); with an average maturity size of 24.0 cm TL and an average weight of 194.6 g in females and 159.6 g in males; followed by Andinoacara rivulatus (19.4%); Cherax quadricarinatus (14.9 %) caught by traps; Hoplias microlepis (12.8%); Oreochromis spp. (3.3%) and Brycon albunus (5.1%). The abundant presence of aquatic floating plants on the banks of the reservoir; hampered fishing and boating activities. The catch average size of freshwater lobster for both sexes was 11.0 cm TL; lower than recommended by the INP 11.5 cm TL minimum size. Sexually mature gonads of fish examined were mainly observed in the months of January (77.9%); February (72.9%) and March (69.8%) and spawning took place in April (86.6 %) and May (79.1%) in 2014.";"Ecología";"https://bit.ly/33gZQLB";"Artículo";"Western Ecuador moist forests";"Ecuador";"Bosques lluviosos"
"402";"Peces_013";-2,223728;-80,118541;"Ecuador";"PECES";"Pacheco 2017";NA;"Pacheco J";2017;"Principales especies capturadas en el embalse de Chongón";"Chongon reservoir; average size at maturity; stages; gonads";"No Aplica";"Diversidad";"https://bit.ly/3h3TxDm";"Artículo";"Western Ecuador moist forests";"Ecuador";"Bosques lluviosos"
"403";"Peces_014";-3,7443306;-80,010636;"Ecuador";"PECES";"Nirchio 2014";NA;"Nirchio M; Oliveira C";2014;"Caracterización citogenética de peces de la Provincia de El Oro.";"Chromosomes; karyotype; taxonomy; fishes";"No Aplica";"Ecología";"https://bit.ly/3h4TTK7";"Artículo";"Eastern Cordillera real montane forests";"Ecuador";"Bosques secos"
"404";"Peces_015";-0,6450556;-80,339012;"Ecuador";"PECES";"García 2014";NA;"García M";2014;"Ictioplancton y peces del estuario del río Chone; Manabí; Ecuador; durante enero 2006 marzo 2007";"Spawning; eggs; larvae; juveniles; ichthyoplankton; artisanal fishing; estuary";"This publication presents the results of the analysis of Ichthyoplankton samples collected from January 2006 until March 2007 on ten stations located in the estuary of the Chone river. It graphically shows the monthly distribution of the most abundant families; as well as the physical-chemical parameters registered on them. Photographic illustrations of juvenile fish collected monthly from hyperbenthos in a fixed station in Leonidas Plaza and a list of fish from the artisanal fishery are included; identifying by order; family; genus; species and common name.";"Ecología";"https://bit.ly/3vY4jiX";"Artículo";NA;NA;"Bosques lluviosos"
"405";"Peces_016";2,0802889;-79,70613;"Ecuador";"PECES";"Fowler 1911";NA;"Fowler H";1911;"New Fresh-Water Fishes from Western Ecuador";"Ecuador; fish; ichthyology";"The most numerous eggs and larvae corresponded to the family engraulidae; scianidae and gobiidae. The higher densities that were found in stations near the ocean suggest that the spawning occurred preferentially towards the outer part of the estuary and from there the Ichthyoplankton was transported by the tides toward the inside of the estuary. The highest concentrations were apparent in the last quarter of the year; coinciding with the low values of salinity; unusual for the time; which arose due to the flow of freshwater from the ‘’the Esperanza” dam; when it began to operate a hydroelectric plant located in the same area. It is recommended to carry out a new study now when the plant has stopped working; to verify the findings referred to in the present investigation.";"H.Natural";"https://bit.ly/33iPKKf";"Artículo";NA;NA;"Bosques lluviosos"
"406";"Peces_017";3,5694389;-79,94291;"Ecuador";"PECES";"Tan et al. 2012";NA;"Tan M; Armbruster J";2012;"Cordylancistrus santarosensis (Siluriformes: Loricariidae); a new species with unique snout deplatation from the Río Santa Rosa; Ecuador";"Ancistrini; armored sucker-mouth catfish; Ecuador; South America; Neotropics";"No Aplica";"Sistemática";"https://bit.ly/3fchtlF";"Artículo";NA;NA;"Bosques lluviosos"
"407";"Peces_018";1,1931778;-79,50605;"Ecuador";"PECES";"Revelo 2009";NA;"Revelo W";2009;"Aspectos biológicos y pesqueros de los principales peces del sistema hídrico de la provincia de Los Ríos; durante 2009";"bocachico; sweet water; frequency; closure; length; ichthyofauna; stages; maturity; proportion";"During 2009 (except May; August and September); a total of 3772 fish specimens comprised of 16 species; dica; were analyzed; the dominant specie was dica with 1561 specimens (42.3%); the less captured were ro´balo and chame with only one individual for each specie; (0.03%). The male female sex ratio; and average catch size and average sexual ripeness of the main fish species were: dama (1: 1.16; 23.7 and 20 cm TL); dica (1: 1.15; 17; 3 and 16 cm TL); guanchiche (1: 1.2; 29 and 20 cm TL); rato´n (1: 1.25; 23.5 and 19 cm TL) and bocachico (1:1; 06; 21; 6 and 20 cm TL). At sexual maturity stages; the majority of species such were found in stage I and II; these were individual immature females; however; for the guanchiche females in stages III; IV and V (55%) were dominant and regarding to males: dama (66%) and rato´n (58%) dominated the stages III; IV and V; respectively. The main fish catch sites were ponds (70%).";"Conservación";"https://bit.ly/3h5vFPN";"Artículo";NA;NA;"Bosques lluviosos"
"408";"Peces_019";3,5694389;-79,94291;"Ecuador";"PECES";"Aguirre et al. 2014";NA;"Aguirre W; Navarrete R; Calle P; Sánchez G";2014;"First Record of Iotabrycon praecox Roberts 1973 (Characidae: Stevardiinae) in the Santa Rosa Drainage; Southwestern Ecuador";"new record; Stevardiinae; Iotabrycon praecox; Ecuador";"Iotabrycon praecox (Characidae: Stevardiinae) has been reported as endemic to the Guayas River drainage in Western Ecuador since its description in 1973. We collected one specimen of I. praecox in the Santa Rosa River; Santa Rosa drainage; El Oro Province; approximately 144 km south of the Guayas drainage; significantly expanding the known geographic distribution of the species. Given the severe anthropomorphic pressures impacting fishes in Southwestern Ecuador; there is an urgent need to evaluate the present status of I. praecox in the region.";"Conservación";"https://bit.ly/3nPJMde";"Artículo";NA;NA;"Bosques lluviosos"
"409";"Peces_020";3,6328194;-80,45605;"Perú";"PECES";"Ortega et al. 2012";NA;"Ortega H; Hidalgo M; Trevejo G; Correa E; Cortijo A; Meza V; Espino J";2012;"Lista anotada de los peces de aguas continentales del Peru. Estado actual del conocimiento; distribución; usos y aspectos de conservación.";"Tumbesina Region; Peru; ichthyology; fish";"The inland fishes of Peru are being investigated as part of a long-term project of the Natural History Museum of the Universidad Nacional Mayor de San Marcos (MHN-UNMSM). Fish have been inventoried through scientific collections in the main river basins; including coastal rivers; high Andean aquatic environments and the Peruvian Amazon. Our studies in aquatic systems in the main natural protected areas have been relatively intensive; which allows us to have a reasonable estimate of fish diversity in these areas. This paper discusses specific inventories in Peruvian coastal rivers and in the high Andes; as well as in some river systems; such as the Amazon; shared with several neighboring countries.
To date; the Scientific Collection of fishes of the Natural History Museum of the Universidad Nacional Mayor de San Marcos contains approximately 450;000 specimens; in approximately 40;000 catalogued lots. Compiling this information with the pertinent scientific literature; 1064 valid native species (55 families and 17 orders) are recognized. Most of the species correspond to the Super Order Ostariophysi (82%); with Characiformes and Siluriformes as the dominant orders. Characidae is the most diverse family comprising 24% of the total number of species. The authors estimate that the number of continental species for Peru would be around 1300 species. Therefore; in order to understand the current diversity of freshwater fishes; it is necessary to carry out more field work in many large hydrographic systems and their tributaries; because some results date back two decades and in those places where accessibility is more restricted; our knowledge is still scarce.
In this publication; in addition to presenting the updated annotated list of fishes for the inland waters of our country (1064 valid species); according to systematic order and including common names and their distribution by major river basins; we discuss the conservation status of aquatic resources and their habitats for fishes in the main river basins of Peru. It also mentions the current
current problems that negatively affect the country's aquatic systems; such as deforestation and gold mining along high forest areas and the Amazonian plain; the direct environmental impacts that have been identified on aquatic systems and their species are also noted: the introduction of exotic species that affect local and regional ichthyofauna; the construction of numerous hydroelectric dams that would mainly affect the natural migration of fish and their reproductive cycles; in addition; overfishing on a regional scale (in the surroundings of large cities such as Iquitos and Pucallpa; fishing efforts have increased notably in the last decade and the catch per unit effort seems to have decreased).
Finally; some recommendations are proposed that could have an important effect on the care of aquatic ecosystems and their fish: the establishment of environmental education programs; communication to the general public about the main problems that threaten freshwater ecosystems and species; and the preparation of future corrective measures for the protection; conservation and recovery of such environments and organisms.";"Distribución";"https://bit.ly/3vPcmhV";"Libro";NA;NA;"Bosques lluviosos"
"411";"veg002";-4,1886;-79,9174111111111;"Ecuador";"PLANTAE";"Aguirre ; Geada-Lopez; (2017)";"ene-jun 2017";"Aguirre-Mendoza Z.; Geada-Lopez G.";2017;"Estado de conservación de los bosques secos de la provincia de Loja; Ecuador.";"Estado de conservación; especie indicadora; tipos de bosque; bosque seco.";"Se muestrearon 100 parcelas de 20 x 20 m en el bosque seco de la provincia de Loja; Ecuador; para determinar los tipos de bosque en función de la composición florística y abundancia de las especies. Se realizó el análisis de conglomerados jerárquico mediante la medida de distancia de Sorensen para tipificar cada tipo de bosque; se calculó el índice de Sorensen cualitativo y cuantitativo. El estado de conservación se determinó utilizando matrices de calificación que consideran seis variables: estructura del bosque; manejo y aprovechamiento; población asociada; matriz del entorno; presencia de fuentes de agua y problemática socioambiental; que son calificadas con base a 26 indicadores; cuyos resultados se expresan en cuatro rangos: 0-25 % (malo); 25;1 a 50 % (regular); 50;1 a 75 % (bueno) y 75;1 a 100 % (muy bueno). Se diferencian tres tipos de bosque seco; indicados por la presencia de Terminalia valverdeae; Simira ecuadorensis; Cordia macrantha (bosque tipo I); Handroanthus chrysanthus; Citharexylum gentryi; Calliandra taxifolia (bosque tipo II); y Eriotheca ruizii; Ipomoea pauciflora; Leucaena trichodes y Erythrina velutina (bosque tipo III); los mismos que presentan diferencias notables en el campo; dadas por las especies y características estructurales. El bosque; en general; se encuentra en buen estado de conservación (57;6 %). El bosque I esta en buen estado (67;5 %) con tendencia a muy bueno; el bosque II esta en buen estado de conservación (57;1%) y el bosque III en buen estado (55;2 %) con tendencia hacia regular.";"Conservación";"http://www.scielo.org.pe/scielo.php?script=sci_arttext;pid=S2413-32992017000100007";"Artículo";"Eastern Cordillera real montane forests";"Ecuador";"Bosques secos"
"412";"veg003";-0,963402777777778;-79,6842722222222;"Ecuador";"PLANTAE";"Aguirre; et.al. (2006)";"38718";"Aguirre-Mendoza Z.; Linares-Palomino R.";2006;"Especies leñosas y formaciones vegetales en los bosques estacionalmente secos de Ecuador y Perú.";"Árboles; arbustos;conservación; diversidad;endemismos; lista anotada; región tumbes.";"Los bosques estacionalmente secos en Ecuador y Perú son biológicamente importantes porque forman el corazón de la Región de endemismo Tumbesina; ésta en su mayor parte está cubierta por bosques estacionalmente secos que ocupan 56455 km2 (49% de la superficie total). Los bosques estacionalmente secos se encuentran en las tierras bajas y faldas occidentales de los Andes; en las provincias de Esmeraldas; Manabí; Guayas; El Oro y Loja en Ecuador y en los departamentos de Tumbes; Piura; Lambayeque; La Libertad y Cajamarca en el Perú. Para caracterizar y analizar los bosques de esta región; hemos considerado un rango altitudinal referencial entre 0 a 1100 m. Los bosques estacionalmente secos se ubican sobre terrenos planos; colinados y en ciertas áreas con pendientes abruptas. Por tradición los bosques estacionalmente secos de la zona han sido sobreexplotados y degradados por extracción de madera; ampliación de frontera agrícola; incendios forestales; pastoreo de ganado caprino y bovino. En últimos años los bosques estacionalmente secos de Ecuador y Perú se han estudiado con intensidad aunque separadamente. Aquí presentamos por primera vez información y análisis combinados para el ecosistema de bosques estacionalmente secos en ambos países. Presentamos una lista anotada conteniendo 313 especies leñosas (arbustos y árboles); de las cuales 239 especies se encuentran en Ecuador (136 reportadas sólo para Ecuador) y 177 en Perú (74 sólo para Perú). Identificamos 66 especies endémicas; de las cuales 17 son exclusivas para Ecuador; 19 exclusivas para Perú y 30 son compartidas en ambos países. Las especies endémicas son el 20% del total; remarcando la importancia de la región;
";"Conservación";"https://www.researchgate.net/publication/262103256_Especies_lenosas_y_formaciones_vegetales_en_los_bosques_estacionalmente_secos_de_Ecuador_y_Peru";"Artículo";"Western Ecuador moist forests";"Ecuador";"Bosques lluviosos"
"413";"veg004";-1,98725555555556;-80,6304;"Ecuador";"PLANTAE";"Astudillo-Sánchez; et.al. (2019)";"2019";"Astudillo-Sánchez E.; Pérez J; Troccoli L.; Aponte H; Tinoco O.";2019;"FLORA LEÑOSA DEL BOSQUE DE GARÚA DE LA CORDILLERA CHONGÓN COLONCHE; SANTA ELENA – ECUADOR";"Dos Mangas; Loma Alta; composición florística; diversidad alfa y diversidad beta";"El objetivo fue analizar la composición; estructura y diversidad florística de Loma Alta a 3 altitudes (164; 300 y 466 m snm) aplicando el método de Gentry. Se registraron 283 especies siendo Fabaceae (26 spp.) la familia más representativa; de estas; 101 spp. (36%) son endémicas y 87 spp. (31%) pertenecen a alguna categoría de conservación (incluyendo a Oreanthes ecuadorensis como en peligro crítico). La estructura estuvo compuesta por 6 clases diamétricas y 7 clases altimétricas; agrupando 81% y 62% de los individuos en la primera categoría. Se reconocen 3 tipos de vegetación: a) bosque seco con Xylosma benthamii; b) bosque de transición con Gustavia serrata y c) bosque de garúa con Rhodostemonodaphne kunthiana como las especies ecológicamente representativas. La diversidad; medida como riqueza fue mayor (37 spp.) para el bosque de transición; la heterogeneidad promedio fue mayor (H’ = 2.40 nats/ind) para el bosque de garúa y la dominancia promedio fue mayor (D = 0.25) para el bosque seco. Los resultados proporcionan evidencia que podría usarse para fortalecer la gestión ambiental del área protegida a nivel local y regional; considerando que cada bosque se destacó por una característica particular; como riqueza; heterogeneidad y dominancia.";"Ecología";"DOI: http://dx.doi.org/10.21704/rea.v18i2.1334";"Artículo";"Ecuadorian dry forests";"Ecuador";"Bosques secos"
