"";"Codigo";"X";"Y";"Pais";"Clase";"Cita";"Fecha";"Autor(es)";"year";"Titulo";"Palabras Clave";"Resumen";"Tematica";"Link";"Tipo";"filtroE";"filtroP";"Bioma"
"225";"art225";-4,37;-80,26;"Ecuador";"AVES";"Orihuela-Torres et al. 2020";"44014";"Orihuela-Torres A; Tinoco B; Ordóñez-Delgado L; Espinosa C.I.";2020;"Knowledge Gaps or Change of Distribution Ranges? Explaining New Records of Birds in the Ecuadorian Tumbesian Region of Endemism.";"distribution; dry tropical forest; Ecuador; global change; species movement";"The change in the distribution range is a common response of various species facing the effects of anthropogenic global change. We used new distribution records of birds reported during the last two decades from the Ecuadorian part of the Tumbesian region (western Ecuador and northwestern Peru) available through a bibliographic review; together with our own field data collected during 2014–2019 and generated a methodology that explored whether these new reports are likely due to knowledge gaps or changes in the distribution range. We classified the species with new records as either Change of distribution range; likely change of distribution range; Accidental; Knowledge gap; or Undetermined based on information about the distribution area; species conspicuousness; and dynamics of the records in the new location. We gathered data for 46 bird species newly reported in the Ecuadorian Tumbesian region in the last two decades. Of this; 35% of species were classified as Accidental; 24% as Knowledge gaps; 22% as Change of distribution range;15% as Undetermined; and 4% as Likely change of distribution range. Species classified as Change of distribution range were mostly aquatic. Terrestrial species were mostly classified as Knowledge gap; while aquatic species were mostly classified as Accidental. Our protocol was validated using species which are known to have modified their distribution range in the Palearctic region; all of which were correctly classified by our methodology. The proposed method was precise and easy to apply and will allow us to better understand how species respond to anthropogenic global change; especially in areas where long-term studies are scarce; such as in tropical areas.";"Distribución";"https://www.mdpi.com/1424-2818/12/2/66";"Artículo";"Tumbes-Piura dry forests";"Ecuador";"Bosques secos"
"226";"art226";-3,37848;-80,13043;"Ecuador";"AVES";"Orihuela-Torres et al. 2018";NA;"Orihuela-Torres A; Ordóñez-Delgado L; López-Rodríguez F; Iñiguez-Armijos C; Pérez-García J";2018;"Spatio-temporal Avian Diversity in the Jambelí Archipelago; Southwestern Ecuador";"census; diversity; Jambelí archipelago; mangrove; waterbirds";"In the last two decades; more than 35% of coastal wetlands in the tropics and subtropics have been destroyed; mangrove forest being the most affected habitat. However; mangroves have been poorly studied around the world; particularly in the Neotropics. The spatio-temporal diversity of the mangrove bird community in the Jambelí archipelago; in southwestern Ecuador; was studied. Between 2 August 2015 and 25 July 2016; a total of 118 species (35 migratory and 83 resident species) belonging to 44 families were documented. Nine of the 83 resident species are endemic to the coasts of Ecuador and northwestern Peru; six are threatened species. The most abundant species in the archipelago were Magnificent Frigatebird (Fregata magnificens) and Neotropic Cormorant (Phalacrocorax brasilianus); while the best represented family was Laridae (n = 12 species). No spatial or temporal differences in bird diversity were detected (P > 0.35). The Jambelí archipelago has a high diversity of bird species; particularly as a wintering and stopover site for boreal migratory species. A long-term monitoring program for bird populations in the area has been proposed as an effective tool to assess the conservation status of this important and threatened ecosystem.";"Ecología";"NA";"Artículo";"South American Pacific mangroves";"Ecuador";"Bosques secos"
"227";"art227";-3,37848;-80,13043;"Ecuador";"AVES";"Orihuela-Torres et al. 2018";"43133";"Orihuela-Torres A; Ordóñez-Delgado L;  Brito J; López F; Marina Mazón M; Freile J";2018;"Ecología trófica del búho terrestre Athene cunicularia punensis (Strigiformes: Strigidae) en el archipiélago de Jambelí; provincia de El Oro; suroeste de Ecuador";"Athene cunicularia punensis; archipelago of Jambelí; diet; pellets; prey";"The diet of Burrowing Owl (Athene cunicularia punensis) was studied in four territories in the Jambelí archipelago; El Oro; southwestern Ecuador; from November 2015 to April 2016; collecting 182 pellets. Arthropods were the main prey group in frequency of occurrence (86.5%); followed by mammals (12%) and birds (1.5%); but mammals (Mus musculus and Rattus rattus) contributed 58.5% of the biomass; arthropods 33.2% and birds 8.2%. No significant differences were found in the diet among the four pairs studied. Our study confirmed the important role of Athene cunicularia as predator of pests like introduced rodents and potentially harmful arthropod.";"H.Natural";"http://www.scielo.org.pe/pdf/rpb/v25n2/a06v25n2.pdf";"Artículo";"South American Pacific mangroves";"Ecuador";"Bosques secos"
"228";"art228";-4,116667;-80,333333;"Ecuador";"AVES";"Orihuela-Torres et al. 2018";"2/20/2018";"Orihuela-Torres A; Ordóñez-Delgado L; Verdezoto-Celi A; Brito J";2018;"Diet of the Spectacled Owl (Pulsatrix perspicillata) in Zapotillo; southwestern Ecuador.";"owls; pellets; prey; trophic ecology; tropical dry forest";"We describe the diet of the Spectacled Owl (Pulsatrix perspicillata) based on the collection and analysis of pellets between 20 to 24 December 2016; from a reproductive territory located in Zapotillo; southwestern Ecuador. Mammals were the main food source of the species; accounting for 80% of the identified prey items and 94% of the biomass.  Other taxonomic groups; such as amphibians; reptiles and crabs were also identified. Based on our results and the existing observations; P. perspicillata consumed a big amount of arboreal prey or those that are located at medium height within the forest. This may be due to their hunting habits; the abundance of available prey or a combination of both. Our observation is the first to document the diet of the subspecies P. perspiciliata chapmani; and increases scarce knowledge about the trophic ecology of this species.";"H.Natural";"https://link.springer.com/content/pdf/10.1007/BF03544415.pdf";"Artículo";"Eastern Cordillera real montane forests";"Ecuador";"Bosques secos"
"229";"art229";-4,276719;-80,329128;"Ecuador";"AVES";"Iñiguez-Gallardo et al. 2021";"2/25/2021";"Iñiguez-Gallardo V; Guerrero A; Ordóñez-Delgado L";2021;"Análisis exploratorio sobre conflictos fauna silvestre-gente en la Reserva Natural Tumbesia La Ceiba; área núcleo de la Reserva de Biosfera Binacional Ecuador-Perú ""Bosques de Paz""";"Wildlife; Conflicts; qualitative interviews; Puma concolor; Dry forests; Ecuador";"Conflicts between wildlife and humans are a complex and growing problem; particularly for the conservation of the species involved in the conflict. Despite the existence of studies analysing this issue in the Neotropics; gaps in geographical and/or thematic knowledge about this discipline remain open. Ecuador is home to an important number of studies focused mainly on the identification of species involved in conflicts. However; the country's coast; particularly the southwest dry forests; has remained untouched by this topic. This study was carried out in the communities surrounding the Tumbesia La Ceiba Natural Reserve; Zapotillo canton; in southern Ecuador. Using a semi-structured interview; applied to local inhabitants; we were able to identify; categorize; and define the frequency; causes; and attitudes towards conflicts with the sector's wildlife. Six types of conflicts were identified: hunting; predation of domestic animals; destruction of crops; medicinal uses; species trafficking; and ofidiophobia. Sixteen species are involved in this problem. Puma Concolor and Lycalopex sechurae are proposed as the most conflictive species. In addition; an organized community response was identified to address the problems caused by the species; and the costs caused by wildlife attacks were found to be significant; primarily when they involved the loss of goats. This work provides a baseline of knowledge on this issue for the country’s southwest; and shows that the only way to address the problem is to establish public and private partnership.";"Manejo";"https://revistasinvestigacion.unmsm.edu.pe/index.php/rpb/article/view/17665/16390";"Artículo";"Eastern Cordillera real montane forests";"Ecuador";"Bosques secos"
"230";"art230";-4,306844;-80,221243;"Ecuador";"AVES";"Córdova-González et al 2020";"44175";"Córdova-González J; Platt M; Ordóñez-Delgado L";2020;"Plegadis ridgwayi (J.A. Allen; 1876) (Aves; Threskiornithidae): range extension and a new country record for Ecuador";"Distribution; dry forests; Loja; Puna Ibis";"We report the second record of Puna Ibis; Plegadis ridgwayi J.A. Allen; 1876 (Aves; Threskiornithidae); from Ecuador and the first record of this species in seasonally dry tropical forests of the southwest of the country. An individual of P.   ridgwayi was sighted in November in Zapotillo; Loja province; 440 km from the only previous record in Ecuador and 65 km from the northernmost Peruvian record. The new record from Ecuador; along with records from the northern coast of Peru; suggests that P. ridgwayi may be expanding its geographic distribution northward in this region.";"Distribución";"https://checklist.pensoft.net/article/54090/";"Artículo";"Tumbes-Piura dry forests";"Ecuador";"Bosques secos"
"231";"art231";-3,563611;-79,470556;"Ecuador";"AVES";"Molina and Ordóñez-Delgado 2019";"9/23/2019";"Molina P; Ordóñez-Delgado L";2019;"Aportes al conocimiento de la biología reproductiva del Pinchaflor Satinado (Diglossa lafresnayii).";"Breeding biology; Diglossa; Ecuador; Egg; Nest";"Additional notes on the breeding of Glossy Flowerpiercer (Diglossa lafresnayii) We describe some unknown aspects of the reproductive biology of the Glossy Flowerpiercer (Diglossa lafresnayii); based on observations of an active nest recorded in the Cerro de Arcos sector; the provincial boundary of El Oro and Loja; Ecuador. The nest was cup-shaped; with measures similar to the only nest previously de-scribed for the species. Inside; a fully feathered chick and an unhatched egg were found; which is described for the first time. In addition; parental care data are reported on elimination and consumption of fecal sacs from the brood.";"H.Natural";"NA";"Artículo";"Northern Andean páramo";"Ecuador";"Bosques lluviosos"
"232";"art232";-3,37848;-80,13043;"Ecuador";"AVES";"Orihuela-Torres et al. 2016";NA;"Orihuela-Torres A; López-Rodríguez F; Ordóñez-Delgado L";2016;"50 aves comunes del Archipiélago de Jambelí";"No aplica";"No aplica";"Diversidad";"NA";"Artículo";"South American Pacific mangroves";"Ecuador";"Bosques secos"
"233";"art233";-2,08288;-80,736684;"Ecuador";"AVES";"Cisneros-Heredia 2006";NA;"Cisneros-Heredia D";2006;"Aves; Podilymbus  podiceps; Ardea  alba; Egretta thula; Nycticorax  nycticorax; Ixobrychus  exilis; Porzana      carolina; Porphyrula      martinica; Gallinula     chloropus; Phalaropus     tricolor; Vanellus  resplendens:  Distribution  extensions;  filling gaps; historical occurrence";"No aplica";"No aplica";"Distribución";"https://checklist.pensoft.net/article/17547/download/pdf/";"Artículo";"Ecuadorian dry forests";"Ecuador";"Bosques secos"
"234";"art234";-0,857778;-80,198028;"Ecuador";"AVES";"Brito et al. 2015";NA;"Brito J; Orellana-Vásquez H; Cadena-Ortiz H; Vargas R; Pozo-zamora G; Curay J";2015;"Mamíferos pequeños en la dieta de la lechuza Tyto alba (Strigiformes: Tytonidae) en dos localidades del occidente de Ecuador; con ampliación distribucional de Ichthyomys hydrobates (Rodentia: Cricetidae).";"Ichthyomys hydrobates; La Ciénaga; Los Santiagos; Owl pellets; Tyto alba";"We analyzed 107 owl pellets and determined 300 prey items grouped into 21 species. The pel-lets were collected at two locations with different environments: Los Santiagos and La Ciénaga in the province of Chimborazo and Manabí in western Ecuador. Our analysis revealed a diet mostly comprised on small mammals; especially rodents which constituted 80%. Among the most abundant prey were Oligoryzomys sp. which accounted for 38.7% of the diet in Los Santiagos’ samples and Sigmodon peruanus 33.6% in La Ciénaga; being 22.5% and 41% respectively of the total biomass consumed at each site. The crab-eating rat Ichthyomys hydro-bates is first reported in this owl’s diet and in the locality of Los Santiagos. This record extends the distributional range of I. hydrobates to southwest Ecuador by about 200 km.";"H.Natural";"https://www.scielo.br/pdf/paz/v55n19/0031-1049-paz-55-19-00261.pdf";"Artículo";"Ecuadorian dry forests";"Ecuador";"Bosques secos"
"235";"art235";-3,45;-79,366667;"Ecuador";"AVES";"Jacobs and Walker 1999";NA;"Jacobs M; Walker J";1999;"Density estimates of birds inhabiting fragments of cloud forest in southernEcuador.";"No aplica";"Between June and September 1995 estimates were made of the population densities of birds inhabiting fragments of unprotected montane cloud forests in southern Ecuador. The study focused on 10 species: Bearded Guan Penelope barbata; Golden-plumed Parakeet Leptosittaca branickii; Red-faced Parrot Hapalopsittaca pyrrhops; White-capped Parrot Pionus seniloides; Grey-breasted Mountain-Toucan Andigena hypoglauca; Barred Fruiteater Pipreola arcuata; Turquoise Jay Cyanolyca turcosa; Great Thrush Turdus fuscater; Hooded Mountain-tanager Buthraupis montana; and Mountain Cacique Cacicus leucoramphus. Species assemblages and population densities varied greatly between sites; despite the presence of similar habitats and altitudinal ranges. Substantial populations of the threatened Bearded Guan; Grey-breasted Mountain-Toucan and Golden-plumed Parakeet were found in areas previously unstudied; as well as in areas previously known to be important. Currently unprotected areas are important for the conservation of montane cloud forest birds.";"Distribución";"NA";"Artículo";"Eastern Cordillera real montane forests";"Ecuador";"Bosques secos"
"236";"art236";-2,196389;-79,999444;"Ecuador";"AVES";"Berg and Angel 2006";"1/13/2006";"Berg k; Angel R";2006;"Seasonal roosts of Red-lored Amazons in Ecuador provide information about population size and structure.";"Amazona autumnalis; Ecuador; mangrove; psittacidae; reproductive populations; roosting; tropical dry forest";"Data from roosts of Amazona parrots may be useful in creating demographic models; because these birds exhibit high roost fidelity and pairs are conspicuous in flight. However; few investigators have attempted to track changes in the number of pairs using such roosts. We studied Red-lored Amazons (Amazona autumnalis) at a communal roost in southwest Ecuador over a 1-yr period to understand better their population structure. Population size was estimated at 214 individuals. Counts revealed seasonal variation in numbers; but the occurrence of pairs and singles was seldom correlated. The number of paired individuals using the roost was lower during the breeding period. In contrast; the number of single birds at the roost nearly doubled during the breeding period. Overall; our data suggest that parental responsibilities during the nesting period explain fluctuations in the number of birds at the roost; and such fluctuations can be used to estimate the reproductive portion of the population. Protection of the small mangrove islands where the parrots roost would likely benefit a population that occupies a much larger area and would; at the same time; provide a useful tool for demographic studies of this poorly known neotropical parrot.";"Ecología";"NA";"Artículo";"Western Ecuador moist forests";"Ecuador";"Bosques lluviosos"
"237";"art237";-4,326389;-80,222222;"Ecuador";"AVES";"Orihuela-Torres et al. 2019";"7/21/2019";"Orihuela-Torres A; Brito J; Pérez-García J";2019;"First observations of the diet of the Pearl Kite (Gampsonyx swainsonii magnus) in southwestern Ecuador";"pellets; prey; raptor; reptiles; trophic ecology; tropicaldry forest";"We describe the diet of Pearl Kite (Gampsonyx swainsonii magnus) by pellet analysis collected in an active nest in southwest Ecuador in May 2018. Reptiles were the most consumed taxonomic group both in frequency of occurrence (FO = 46.4%) and in biomass (B = 59.8%); followedby birds (FO = 33.9% and B = 38.3%) and insects (FO = 19.6% and B = 1.8%). Our results showed Pearl Kite as a generalist raptor but with a higher consumption of reptiles; which is according with previous studies in other areas where other subspecies inhabit; despite this subspecies showed a higher consumption of birds. Despite the low sample size; this study is interesting as it is the first one on the diet of the Pearl Kite for Ecuador and also for this subspecies. Basic studies on the trophic ecology of Neotropical raptors such as this are needed. For this reason we encourage further studies to fill existing gaps in knowledge and improve effective long-term conservation strategies.";"H.Natural";"https://link.springer.com/content/pdf/10.1007/BF03544470.pdf";"Artículo";"Tumbes-Piura dry forests";"Ecuador";"Bosques secos"
"238";"art238";-2,150168;-79,874174;"Ecuador";"AVES";"Freile et al. 2012";NA;"Freile J; Salas J; Alejandro Solano-Ugalde A; Navarrete R";2012;"Brotogeris versicolorus (Statius Müller; 1776) (Aves: Psittacidae): Introduced established population in Ecuador.";"No aplica";"We report the first confirmed evidence of a feral introduced population of Brotogeris versicolorus (Statius Müller; 1776) in Guayaquil city; Ecuador; as part of the World Parrot Count led by City Parrots. A total of 216 individuals were counted; at two places within the city; but no direct evidence of breeding was found. A previously unpublished photograph suggesting nesting activity is also presented; along with brief comments on previous and additional observations and the conservation implications of this recently established feral species.";"Ecología";"https://checklist.pensoft.net/article/18449/";"Artículo";"Western Ecuador moist forests";"Ecuador";"Bosques lluviosos"
"239";"art239";-3,533333;-79,133333;"Ecuador";"AVES";"Rahbek et al. 1993";NA;"Rahbek C; Bloch H; Poulsen M; Rasmussen J";1993;"Avian body weights from southern Ecuador";"No aplica";"No aplica";"Diversidad";"https://biostor.org/reference/112186";"Artículo";"Eastern Cordillera real montane forests";"Ecuador";"Bosques secos"
"240";"art240";-2,248034;-80,580096;"Ecuador";"AVES";"Tellkamp 2019";"12/14/2018";"Tellkamp M";2019;"A story told from a small-mesh screen: the importance of song birds and ground doves to the Guangala people at the El Azúcar archeological site in coastal Ecuador.";"Guangala; Garden hunting; Net-hunting; Small-meshed screens; Songbirds; Ground doves; Climate variability";"The Guangala people of El Azúcar; located 25 km from the Ecuadorean coast; specialized on the production of beads and hunting for trade between approximately 150 BC and 370 AC. In this study; I analyzed the avian component of the zooarchaeological remains to examine patterns in resource use and paleoecological conditions during site occupancy. For comparison; I also identified the bird bones from three archeological sites in the Valdivia Valley; 38 km to the north. The composition of the avifauna at the El Azúcar site is highly unusual. Unlike at any other sites; including the Valdivia Village sites examined in this study; songbirds and small ground doves make up over 90% of all samples. The large number of songbirds and columbids is probably due to a combination of (1) taphonomy; (2) the use of 1/8 in. mesh for screening of sediments during excavation; and (3) local adaptations in resource use. Novel hypotheses regarding the exploitation of birds by the Guangala people of El Azúcar are presented. Most importantly; I posit that most birds were probably hunted by women and children in and around agricultural plots; perhaps by using fishing nets. The avifauna at El Azúcar and the Valdivia Village suggest that climate was variable; consistent with the expected impact of the El Niño Southern Oscillation on the Ecuadorian coast. These insights could not have been gained without the use of 1/8-in screens and species-level identifications of the zooarchaeological specimens.";"H.Natural";"NA";"Artículo";"Ecuadorian dry forests";"Ecuador";"Bosques secos"
"241";"art241";-3,768694;-79,860972;"Ecuador";"AVES";"Cabrera and van der Hoek 2018";NA;"Cabrera J; van der Hoek Y";2018;"Additional records of aberrant plumage coloration of the groove-billed ani (crotophaga sulcirostris).";"Aberrant plumage; Crotophaga sulcirostris; Ecuador; Leucism; Progressive greying";"Chromatic aberrations have previously been reported for the normally entirely black Groove-billed Ani (Crotophaga sulcirostris). Here; we present three additional observations of the occurrence of chromatic aberrations in this species; in the southwest of Ecuador.  In May 2016; we observed two birds with a nearly entirely white coloration; except for a few small black spots; and one pied-colored bird; with a mix of white and black coloration on all main body parts.  Most likely; these chromatic aberrations are cases of progressive greying.  Future studies should determine whether multiple individuals with chromatic aberration in the same place are a coincidence or due toother reasons.";"H.Natural";"http://bit.ly/3rdFZ9G";"Artículo";"Eastern Cordillera real montane forests";"Ecuador";"Bosques secos"
"242";"art242";0,968151;-79,17772;"Ecuador";"AVES";"Zimmer 1934";"5/31/1934";"Zimmer J";1934;"Studies on Peruvian Birds XIII. The genera Dendrexetastes; Campylorhamphus; and Dendrocincla";"No aplica";"No aplica";"Diversidad";"NA";"Artículo";"Western Ecuador moist forests";"Ecuador";"Bosques lluviosos"
"243";"art243";-2,08288;-79,7;"Ecuador";"AVES";"Alava and Haase B";NA;"Alava J; Haase B";2011;"Waterbird Biodiversity and Conservation Threats in Coastal Ecuador and the Galapagos Islands";"No aplica";"No aplica";"Conservación";"NA";"Artículo";"Guayaquil flooded grasslands";"Ecuador";"Bosques secos"
"244";"art244";-2,226969;-80,927124;"Ecuador";"AVES";"Campbell 1976";NA;"Campbell K";1976;"The Late Pleistocene Avifauna of La Carolina; Southwestern Ecuador.";"No aplica";"A collection of fossils from the late Pleistocene site known as La Carolina; located on the arid Santa Elena Peninsula of southwestern Ecuador; contains 53 species of birds; representing 16 families and 42 genera; including 7 extinct species previously recorded only from the Talara Tar Seeps of northwestern Peru. New species of Buteo and Oreopholus are described. The genus Protoconurus Spillman is synonymized with Aratinga. Seventy-two percent of the species recorded from La Carolina were also recorded from the Talara Tar Seeps. The resemblance between the two avi-faunas suggests a similarity in age; habitat; and climatological conditions at the two sites at the time of deposition. Evidence suggests that during glacial periods the currently arid Santa Elena Peninsula was part of a broad; forested coastal savanna extending from central Ecuador south to northern Peru.";"Diversidad";"NA";"Artículo";"Ecuadorian dry forests";"Ecuador";"Bosques secos"
"245";"art245";-1,8014;-79,511315;"Ecuador";"AVES";"Peñafiel and Merino 2019";NA;"Peñafiel G; Merino J";2019;"Los Ríos - Aves de las inmediaciones de la Universidad Técnica de Babahoyo";"No aplica";"No aplica";"Diversidad";"https://fieldguides.fieldmuseum.org/es/gu%C3%ADas/gu%C3%ADa/1104";"Artículo";"Ecuadorian dry forests";"Ecuador";"Bosques secos"
"246";"art246";-2,047946;-79,923468;"Ecuador";"AVES";"Zavala 2018";NA;"Zavala E";2018;"Guayas - Aves del Cerro Totoral y sus alrededores";"No aplica";"No aplica";"Diversidad";"https://fieldguides.fieldmuseum.org/es/gu%C3%ADas/gu%C3%ADa/961";"Artículo";"Western Ecuador moist forests";"Ecuador";"Bosques lluviosos"
"247";"art247";-4,258216;-79,216721;"Ecuador";"AVES";"Cadena-Ortiz 2013";NA;"Cadena-Ortiz H";2013;"Loja - Aves Comunes de Rumi Wilco.";"No aplica";"No aplica";"Diversidad";"https://fieldguides.fieldmuseum.org/es/gu%C3%ADas/gu%C3%ADa/448";"Artículo";"Eastern Cordillera real montane forests";"Ecuador";"Bosques secos"
"248";"art248";-3,518533;-80,131709;"Ecuador";"AVES";"Narváez Romero et al. 2012";NA;"Narváez Romero C; Salazar M; Cartuche C; Espinosa C.I.";2012;"EL Oro - Aves de la Reserva Ecológica Arenillas.";"No aplica";"No aplica";"Diversidad";"https://fieldguides.fieldmuseum.org/sites/default/files/rapid-color-guides-pdfs/366_Aves_de_la_Reserva_Arenillas_c1_2.pdf";"Artículo";"Tumbes-Piura dry forests";"Ecuador";"Bosques secos"
"249";"art249";-3,666667;-79,733333;"Ecuador";"AVES";"Robbins and Ridgely 1990";NA;"Robbins M; Ridgely R";1990;"The Avifauna of an Upper Tropical Cloud Forest in Southwestern Ecuador.";"avifauna; cloud forest; Ecuador";"We recorded 181 avian species at the southern terminus of the upper tropical cloud forest in southwestern Ecuador. A list of the bird species recorded; with an indication of relative abundance is given. We present additional information on the status; distribution; behavior; habitat preferences; and systematics of 35 of these species.";"Diversidad";"https://www.jstor.org/stable/4064971";"Artículo";"Eastern Cordillera real montane forests";"Ecuador";"Bosques secos"
